platform,text,timestamp,source,clean_text
reddit,"I'm investing for the first time in years Hey guys. For context I'm from Argentina so 120 dollars monthly here is a decent amount of money to invest in stocks.

With that being said, I opened my portfolio through a broker that allows me to access the US market without any fees or restrictions that I would face if I use any CEDEARS (basically US stocks mirrored in Argentine pesos), and started my tiny portfolio with what I think is a more than decent diversification.

While I'm no MBA I do have prior experience in stock markets, investing, options, crypto and other tools, but I played with fire some years ago (LUNA flashbacks) and basically chickened out of crypto and investments all together, especially since I lost my job a year ago.

I now have a stable good paying job and I can invest around $100-$120 USD monthly ($117,23 this month), and decided to build a rather safe and conservative portfolio consisting off: 35% in SPDR 500, 15% each in VTI and QQQ, 5% each in KO, JNJ, and AAPL, 7% in MSFT, and 6% each in NVDA, AMZN, and META.

I did some math and corroborated this info with some help of AI and apparently I would be getting between 5% and 15% returns annually including dividends (can be more if the market goes bullish).

Any advise? Any changes I should do? Do you think this portfolio is good? All help will be highly appreciated!",2026-01-06 00:28:55,investing,i m investing for the first time in years hey guys for context i m from argentina so dollars monthly here is a decent amount of money to invest in stocks with that being said i opened my portfolio through a broker that allows me to access the us market without any fees or restrictions that i would face if i use any cedears basically us stocks mirrored in argentine pesos and started my tiny portfolio with what i think is a more than decent diversification while i m no mba i do have prior experience in stock markets investing options crypto and other tools but i played with fire some years ago luna flashbacks and basically chickened out of crypto and investments all together especially since i lost my job a year ago i now have a stable good paying job and i can invest around usd monthly this month and decided to build a rather safe and conservative portfolio consisting off in spdr each in vti and qqq each in ko jnj and aapl in msft and each in nvda amzn and meta i did some math and corroborated this info with some help of ai and apparently i would be getting between and returns annually including dividends can be more if the market goes bullish any advise any changes i should do do you think this portfolio is good all help will be highly appreciated
reddit,"If the Supreme Court rules against Trump and overturnes existing tarriffs, which stocks will benefit the most? 
Although this outcome isn't guaranteed, it's absolutely certain that markets would react swiftly to this announcement, which is due within the next few months (possibly even days or weeks).

It stands to reason that if tariffs are overturned, importers would benefit significantly. This is because they won't be subject to import fees and will be able to either lower their prices and gain market share, or keep current maintain market share and lower their overhead costs. This includes retailers like Walmart (WMT), Best Buy (BBY), as well as tech stocks like Apple (AAPL), Intel (INTC) and Nvidia (NVDA).

Similarly, domestic manufacturing like Nucor steel (NUE) and United States Steel (X) would suffer from this ruling. This is because they will suffer from higher operating costs and will loose profit margins, or ultimately loose market share due to these higher costs.

Others I think will vary over time. For example, Caterpillar (CAT) might suffer initially since they manufature in the US, but they might gain long term due to lower capital overhead.

I think these are all reasonable bets, but who do you think stands to benefit or loose the most? Which stocks would be the most timely to purchase based on other factors? I'm interested mostly in purchasing rather than shorting, but would enjoy takes on both long term and short term gains.",2026-01-06 00:27:12,investing,if the supreme court rules against trump and overturnes existing tarriffs which stocks will benefit the most although this outcome isn t guaranteed it s absolutely certain that markets would react swiftly to this announcement which is due within the next few months possibly even days or weeks it stands to reason that if tariffs are overturned importers would benefit significantly this is because they won t be subject to import fees and will be able to either lower their prices and gain market share or keep current maintain market share and lower their overhead costs this includes retailers like walmart wmt best buy bby as well as tech stocks like apple aapl intel intc and nvidia nvda similarly domestic manufacturing like nucor steel nue and united states steel x would suffer from this ruling this is because they will suffer from higher operating costs and will loose profit margins or ultimately loose market share due to these higher costs others i think will vary over time for example caterpillar cat might suffer initially since they manufature in the us but they might gain long term due to lower capital overhead i think these are all reasonable bets but who do you think stands to benefit or loose the most which stocks would be the most timely to purchase based on other factors i m interested mostly in purchasing rather than shorting but would enjoy takes on both long term and short term gains
reddit,"Investment For Infant Daughter I apologize if this is the wrong place for this. Mods-remove if needed. 

My wife and I just had our first. A little girl. She’s pretty cool. We think we’re gonna keep her /s 

Anyways the wife is home on baby leave and devouring Gilmore Girls for the fifth time. From time to time, I’m in the living room with her watching it. It is…a good show tbh. Great dialogue. I digress. 

In on episode, Lorelai’s father Richard gifts her the financial gains from an investment he made for her when she was an infant. $75,000. A great windfall for sure. But it got me thinking-how could I do something similar for my daughter? What would be the best vehicle to accomplish this. 

I obviously don’t expect the same returns as Richard gained on the investment for Lorelai. I, after all, am not a Yale alumnus (lowly state school offspring here) and am not known for making the best picks in the market. I have since distilled my portfolio down into an extremely boring albeit stable mix of stocks and practice DCA. 

Anyways, how could I go about doing this for my daughter? Some sort of brokerage account for children? Thanks in advance. ",2026-01-05 23:45:33,investing,investment for infant daughter i apologize if this is the wrong place for this mods remove if needed my wife and i just had our first a little girl she s pretty cool we think we re gonna keep her s anyways the wife is home on baby leave and devouring gilmore girls for the fifth time from time to time i m in the living room with her watching it it is a good show tbh great dialogue i digress in on episode lorelai s father richard gifts her the financial gains from an investment he made for her when she was an infant a great windfall for sure but it got me thinking how could i do something similar for my daughter what would be the best vehicle to accomplish this i obviously don t expect the same returns as richard gained on the investment for lorelai i after all am not a yale alumnus lowly state school offspring here and am not known for making the best picks in the market i have since distilled my portfolio down into an extremely boring albeit stable mix of stocks and practice dca anyways how could i go about doing this for my daughter some sort of brokerage account for children thanks in advance
reddit,"A new year, a clean slate, and a calmer mindset toward investing We’ve officially entered a new year. It feels like a natural moment to pause for a second and reflect, not just on returns, but on how we approach investing itself. Over time I’ve learned that markets will always do what they do, but our reactions slowly evolve. What once felt stressful starts to feel manageable. What felt urgent starts to feel less important

I’m not setting big resolutions or making dramatic changes. For me, the goal going into this year is simply to stay disciplined, keep emotions in check, and let time do its work. Wishing everyone here a steady, thoughtful, and healthy year ahead -both in the markets and beyond.",2026-01-05 23:29:55,investing,a new year a clean slate and a calmer mindset toward investing we ve officially entered a new year it feels like a natural moment to pause for a second and reflect not just on returns but on how we approach investing itself over time i ve learned that markets will always do what they do but our reactions slowly evolve what once felt stressful starts to feel manageable what felt urgent starts to feel less important i m not setting big resolutions or making dramatic changes for me the goal going into this year is simply to stay disciplined keep emotions in check and let time do its work wishing everyone here a steady thoughtful and healthy year ahead both in the markets and beyond
reddit,"Finding Buy prospects in large, mid and small cap I've posted before how I compare revenue growth and operating margin to operating multiple to find stocks to buy. I've used this for the last two years and generated above market returns both years.

I generally look for a minimum sum of 40 for revenue growth plus operating margin. Then I divide that by the projected operating multiple. If the result is greater than 2.0, I consider the stock a prospect for more research.

[Stock Screener](https://docs.google.com/spreadsheets/d/16G33KovFyQpIzb7AF2062M1NINrz6-L43FsOA2iyWaM/edit?usp=sharing)

I'm focused on large caps right now and currently holding NVDA, MU, GOOGL, META, MSFT and LLY.

There can be plenty of errors in a free stock screener, so please do your own research before making any investment decision.",2026-01-05 23:22:34,investing,finding buy prospects in large mid and small cap i ve posted before how i compare revenue growth and operating margin to operating multiple to find stocks to buy i ve used this for the last two years and generated above market returns both years i generally look for a minimum sum of for revenue growth plus operating margin then i divide that by the projected operating multiple if the result is greater than i consider the stock a prospect for more research stock screener i m focused on large caps right now and currently holding nvda mu googl meta msft and lly there can be plenty of errors in a free stock screener so please do your own research before making any investment decision
reddit,"Buying gold coins (UK based) I'm considering buying some physical gold to make use of the CGT benefits longer term. What would people recommend to buy, new coins from the royal mint or used coins through a dealer. Have people found a cheap way of getting close to spot price when buying and selling while still guaranteeing authenticity. ",2026-01-05 23:07:44,investing,buying gold coins uk based i m considering buying some physical gold to make use of the cgt benefits longer term what would people recommend to buy new coins from the royal mint or used coins through a dealer have people found a cheap way of getting close to spot price when buying and selling while still guaranteeing authenticity
reddit,"Investing in VOO or VTI as non-american (dutch) I am planning on investing somewhere around €10.000 into an ETF. This investment would be long term. Since I hear a lot of good things about VOO and VTI I am leaning towards one of these two ETS's. Besides the positive things I've heard about these ETF's I've also heard that you need to pay 15% dividend tax and possibly US inheritance tax. Is this true and does that mean that it would be wiser to invest in some other ETF? If so, I am eager to hear reccommendiations for other options.",2026-01-05 22:58:41,investing,investing in voo or vti as non american dutch i am planning on investing somewhere around into an etf this investment would be long term since i hear a lot of good things about voo and vti i am leaning towards one of these two ets s besides the positive things i ve heard about these etf s i ve also heard that you need to pay dividend tax and possibly us inheritance tax is this true and does that mean that it would be wiser to invest in some other etf if so i am eager to hear reccommendiations for other options
reddit,"Phillips 66 (PSX) to Acquire Lindsay Refinery Assets, a Strategic Move for Growth? Phillips 66 (PSX) has announced its agreement to acquire the Lindsay Refinery assets and related infrastructure in the UK. This move is set to bolster their operations, especially as they integrate the assets into their Humber Refinery. The company has stated that after thorough evaluations, it decided not to restart Lindsay’s independent operations due to scale and operational constraints. Instead, Phillips 66 will incorporate these assets into its existing refinery system, potentially leading to improved efficiency and synergies.

With this acquisition, Phillips 66 is making strategic moves to strengthen its position in the energy sector and diversify its operations. The decision not to revive Lindsay as an independent refinery seems prudent, as it could streamline operations and avoid the risk of a costly restart. Given the broader push towards sustainable fuels and Phillips 66's strong presence in the refining market, this could be a good time to consider adding PSX to your portfolio.

Do you think this acquisition will positively impact PSX’s long term growth and stock performance?",2026-01-05 22:02:11,investing,phillips psx to acquire lindsay refinery assets a strategic move for growth phillips psx has announced its agreement to acquire the lindsay refinery assets and related infrastructure in the uk this move is set to bolster their operations especially as they integrate the assets into their humber refinery the company has stated that after thorough evaluations it decided not to restart lindsay s independent operations due to scale and operational constraints instead phillips will incorporate these assets into its existing refinery system potentially leading to improved efficiency and synergies with this acquisition phillips is making strategic moves to strengthen its position in the energy sector and diversify its operations the decision not to revive lindsay as an independent refinery seems prudent as it could streamline operations and avoid the risk of a costly restart given the broader push towards sustainable fuels and phillips s strong presence in the refining market this could be a good time to consider adding psx to your portfolio do you think this acquisition will positively impact psx s long term growth and stock performance
reddit,"Do Fidelity.com comparison charts already factor in fees? Long story short, looking to swap some mutual funds to ETF's, but the comparison charts show that a couple of my funds have outperformed VT, VOO and QQQ over multiple timeframes. Not by huge amounts, but still rather significant.

I know past performance does not equal yada yada yada, but I wonder if I should just keep money where it's been for the last 30 years. It seems to have done well.",2026-01-05 21:27:21,investing,do fidelity com comparison charts already factor in fees long story short looking to swap some mutual funds to etf s but the comparison charts show that a couple of my funds have outperformed vt voo and qqq over multiple timeframes not by huge amounts but still rather significant i know past performance does not equal yada yada yada but i wonder if i should just keep money where it s been for the last years it seems to have done well
reddit,"Margin charged for open orders? Hi all - I'm fairly certain the answer to the below is no, but asking search/AI engines has resulted in various or open ended answers, so I thought the community might be able to help put this to bed.

I'm in the process of investing my account.  Half is in index funds and the other half in SGOV while waiting.  100% of my cash is being utilized.

Since I can only place open orders in this dcenario if I am approved for margin, (1) would I be charged interest on the value of open orders while being fully invested if settlement balance is zero or positive and (2) if I sell SGOV on the same day my open orders are filled to zero out settlement funds the next day, with both having T+1 settlement, will I be charged margin for a day?

Thank you!

  
edit:  would margin charging practices vary by brokerage?",2026-01-05 21:11:47,investing,margin charged for open orders hi all i m fairly certain the answer to the below is no but asking search ai engines has resulted in various or open ended answers so i thought the community might be able to help put this to bed i m in the process of investing my account half is in index funds and the other half in sgov while waiting of my cash is being utilized since i can only place open orders in this dcenario if i am approved for margin would i be charged interest on the value of open orders while being fully invested if settlement balance is zero or positive and if i sell sgov on the same day my open orders are filled to zero out settlement funds the next day with both having t settlement will i be charged margin for a day thank you edit would margin charging practices vary by brokerage
reddit,"How should you adjust your investment portfolio in the new year? 2025 was a very fruitful year for me. All three major stock indices rose, with the Nasdaq Composite performing best, gaining 25%-30% for the year, significantly outperforming the broader market and ultimately emerging as the winner. If you had chosen a stock from this index and held it for a year, the probability of profit would have been as high as 70%. If you held a portfolio of stocks from Nvidia, Intel, or other semiconductor companies, the return would have exceeded 40%. How did your stock portfolio perform? Of course, 2025 was also a lucky year for me. Through discussions with some friends in the investment community, I gained some valuable information and benefited greatly. Therefore, I sold my underperforming stocks and bought some shares of Nvidia, Intel, and AVGO. Although there were some fluctuations, I ultimately achieved a good return. Market news is often more important than technical analysis. I recently learned that the artificial intelligence bubble is expanding, and the market is starting to shift to other industries, which will become new growth points next year. There is a good chance that some new hot stocks will emerge, performing even better than Nvidia. I am still closely monitoring the situation and waiting for the right opportunity.",2026-01-05 21:01:14,investing,how should you adjust your investment portfolio in the new year was a very fruitful year for me all three major stock indices rose with the nasdaq composite performing best gaining for the year significantly outperforming the broader market and ultimately emerging as the winner if you had chosen a stock from this index and held it for a year the probability of profit would have been as high as if you held a portfolio of stocks from nvidia intel or other semiconductor companies the return would have exceeded how did your stock portfolio perform of course was also a lucky year for me through discussions with some friends in the investment community i gained some valuable information and benefited greatly therefore i sold my underperforming stocks and bought some shares of nvidia intel and avgo although there were some fluctuations i ultimately achieved a good return market news is often more important than technical analysis i recently learned that the artificial intelligence bubble is expanding and the market is starting to shift to other industries which will become new growth points next year there is a good chance that some new hot stocks will emerge performing even better than nvidia i am still closely monitoring the situation and waiting for the right opportunity
reddit,"How many different Index Funds are you invested in? [https://www.reddit.com/r/investing/s/LnelGVWl3V](https://www.reddit.com/r/investing/s/LnelGVWl3V)

This is a continuation of my post from yesterday. I appreciate all of the valuable insight. And I am coming to the realization that I’m holding onto too much cash.

My question is, how many different index funds should I be invested in? Right now I hold VOO IYW and SPTE, as well as other individual stocks. Also what is the maximum amount I should have in a single index?

I understand that broad index funds will all have similar returns. But my concern is that if one fails for whatever reason and you have all your eggs in that basket, you’re screwed.",2026-01-05 20:16:30,investing,how many different index funds are you invested in this is a continuation of my post from yesterday i appreciate all of the valuable insight and i am coming to the realization that i m holding onto too much cash my question is how many different index funds should i be invested in right now i hold voo iyw and spte as well as other individual stocks also what is the maximum amount i should have in a single index i understand that broad index funds will all have similar returns but my concern is that if one fails for whatever reason and you have all your eggs in that basket you re screwed
reddit,"Following up on my post from last week, another $WRB buy. What the **** do they know? So, after I wrote last week about this Mitsui Sumitomo Insurance Co., Ltd. That is already own around 10% of the company inside buying, they bought again.

On Jan 3, 2026, Mitsui Sumitomo Insurance Co., Ltd. (already a ~10% owner) reported an open-market purchase of:
	•	672,734 shares
	•	Avg price: $70.11
	•	About $47M deployed

Now What makes this interesting is that it’s not any single transaction. This is the third buying in few weeks.
The first was around $42.5M
And then around $62M
and now another $47M

All from the same buyer in open market.

So, what do you think they know?",2026-01-05 20:06:24,investing,following up on my post from last week another wrb buy what the do they know so after i wrote last week about this mitsui sumitomo insurance co ltd that is already own around of the company inside buying they bought again on jan mitsui sumitomo insurance co ltd already a owner reported an open market purchase of shares avg price about m deployed now what makes this interesting is that it s not any single transaction this is the third buying in few weeks the first was around m and then around m and now another m all from the same buyer in open market so what do you think they know
reddit,"Do you feel like graphs dont matter anymore? Hi everyone,

I do not invest myself but do have a degree in economy and im curious what you think about this take.

In recent years we see that pretty much all countries make all sorts of moves, too many fake news, scams, geopolitical situations and etc. So it seems that analysing the graph is pointless. 

Countries break international law, make pyramid schemes, AI companies have fake balances, countries do not make logical economic decisions and the ehole politics and relations look like WWE now wirhout anyone caring.

S&amp;P is also pointless now since it relies on couple of companies with very doubtfull worth.

So do you think that graph analysis is pointless now?",2026-01-05 19:57:36,investing,do you feel like graphs dont matter anymore hi everyone i do not invest myself but do have a degree in economy and im curious what you think about this take in recent years we see that pretty much all countries make all sorts of moves too many fake news scams geopolitical situations and etc so it seems that analysing the graph is pointless countries break international law make pyramid schemes ai companies have fake balances countries do not make logical economic decisions and the ehole politics and relations look like wwe now wirhout anyone caring s amp p is also pointless now since it relies on couple of companies with very doubtfull worth so do you think that graph analysis is pointless now
